{
  "contractVersion": 1,
  "identity": {
    "solutionCode": "referenceCombined",
    "customerCode": "reference",
    "projectCode": "referenceCombined",
    "displayName": "Reference Combined Commerce"
  },
  "environment": {
    "mode": "WORKSPACE",
    "class": "LOCAL",
    "deploymentShape": "MODULAR_PROCESSES"
  },
  "capabilities": {
    "selected": [
      "nodics.commerce",
      "apparel",
      "electronics",
      "telco"
    ],
    "domains": [
      "APPAREL",
      "ELECTRONICS",
      "TELCO"
    ],
    "excluded": []
  },
  "commerce": {
    "stores": [
      "mainStore"
    ],
    "catalogs": [
      "apparelCatalog",
      "electronicsCatalog",
      "telcoCatalog",
      "contentCatalog"
    ],
    "locales": [
      "en",
      "ar-AE"
    ],
    "currencies": [
      "AED",
      "USD"
    ],
    "markets": [
      "AE"
    ]
  },
  "topology": {
    "backendRuntimes": [
      "PLATFORM",
      "WCMS_STAGED",
      "WCMS_ONLINE",
      "PROCESS",
      "ENGAGEMENT",
      "COMMERCE"
    ],
    "frontends": [
      "AXIS",
      "NEXUS",
      "AGORA"
    ]
  },
  "experience": {
    "storefront": "AGORA",
    "composition": "combined",
    "routes": [
      "/",
      "/apparel",
      "/electronics",
      "/telco"
    ],
    "rendererKeys": [
      "agora.apparel.product-card",
      "agora.electronics.product-card",
      "agora.telco.product-card"
    ],
    "themeCode": "referenceTheme",
    "rendererByDomain": {
      "apparel": "agora.apparel.product-card",
      "electronics": "agora.electronics.product-card",
      "telco": "agora.telco.product-card"
    }
  },
  "security": {
    "authentication": "PASSWORD_AND_OIDC",
    "authorization": "BACKEND_OWNED",
    "session": "SECURE_BROWSER_SESSION",
    "corsOrigins": [
      "http://127.0.0.1:3300"
    ],
    "publicApiCategories": [
      "customer",
      "contentDelivery"
    ]
  },
  "integrations": [
    {
      "code": "localProvisioning",
      "kind": "PROVISIONING",
      "certificationState": "LOCAL_ADAPTER",
      "secretReference": "secrets/telco/provisioning",
      "required": true
    }
  ],
  "data": {
    "packs": [
      "agora.apparel",
      "agora.electronics",
      "agora.telco",
      "nexus.web"
    ],
    "customerOwnedRoots": [
      "modules/agora.apparel/data",
      "modules/agora.electronics/data",
      "modules/agora.telco/data",
      "modules/nexus.web/data"
    ],
    "sampleData": true,
    "packDomains": {
      "agora.apparel": "apparel",
      "agora.electronics": "electronics",
      "agora.telco": "telco",
      "nexus.web": "content"
    }
  },
  "qualification": {
    "profile": "LOCAL_END_TO_END",
    "journeys": [
      "apparel.size-colour-checkout",
      "electronics.warranty-checkout",
      "telco.device-plan-provisioning",
      "commerce.mixed-cart"
    ],
    "freshDatabaseRequired": true,
    "browserRequired": true
  },
  "decisions": {
    "unresolved": [],
    "assumptions": [
      "External providers remain behind local deterministic adapters."
    ]
  }
}
